{
  "schema_version": 2,
  "metadata": {
    "run_id": "8b4cabd9362a47d98a36f7649f23ca1b",
    "created_at_utc": "2026-10-19T01:58:09.365309+00:00",
    "benchmark_version": "0.1.0",
    "evaluator_sha256": "b16921b69df55c6d40eeaed9586f2270135206ba99ad05d08dddd3df57fed13a",
    "python_version": "3.14.3",
    "platform": {
      "system": "Windows",
      "release": "11",
      "machine": "AMD64"
    },
    "compiler": {
      "name": "tcc",
      "version": "tcc version 0.9.27 (x86_64 Windows)",
      "target": {
        "target": "host"
      },
      "optimization": "native",
      "allow_standard_fallback": false
    },
    "static_analysis": {
      "engine": "builtin",
      "cppcheck_version": null,
      "configuration": {
        "version": 4,
        "builtin_rules": [
          "allocation-reference",
          "misra.15.1",
          "floating-types",
          "misra.4.6",
          "host-process",
          "host-network",
          "host-filesystem"
        ],
        "extended_rules": false,
        "max_output_bytes": 1048576,
        "max_findings": 200,
        "timeout_seconds": 30.0,
        "basic_type_exceptions": [
          "plain int (status/main APIs)",
          "plain char (character data)"
        ],
        "cppcheck_enabled": [
          "warning",
          "style",
          "performance",
          "portability"
        ],
        "inconclusive": true,
        "standard": "task effective standard",
        "error_severities": [
          "error"
        ],
        "warning_severities": [
          "warning",
          "style",
          "performance",
          "portability"
        ]
      }
    },
    "source_revision": "e8219e5a75ab26ac99b3ec1189fb4e25f04c2b04",
    "source_dirty": false,
    "selected_tasks": [
      "tier1_crc16",
      "tier1_q15_math",
      "tier1_ring_buffer",
      "tier2_can_frame",
      "tier2_cobs_codec",
      "tier2_debounce_fsm",
      "tier2_fixed_control",
      "tier2_tick_timer",
      "tier2_windowed_watchdog",
      "tier3_flash_update",
      "tier3_i2c_sensor",
      "tier3_spi_flash",
      "tier4_bitmask_fix",
      "tier4_dma_buffer",
      "tier4_uart_frame_fix"
    ],
    "task_categories": {
      "tier1_crc16": "core_fundamentals",
      "tier1_q15_math": "core_fundamentals",
      "tier1_ring_buffer": "core_fundamentals",
      "tier2_can_frame": "fsm_and_protocols",
      "tier2_cobs_codec": "fsm_and_protocols",
      "tier2_debounce_fsm": "fsm_and_protocols",
      "tier2_fixed_control": "fixed_point_control",
      "tier2_tick_timer": "fsm_and_protocols",
      "tier2_windowed_watchdog": "fsm_and_protocols",
      "tier3_flash_update": "flash_management",
      "tier3_i2c_sensor": "device_drivers",
      "tier3_spi_flash": "device_drivers",
      "tier4_bitmask_fix": "bug_fix_and_safety",
      "tier4_dma_buffer": "concurrency",
      "tier4_uart_frame_fix": "bug_fix_and_safety"
    },
    "task_fingerprints": {
      "tier1_crc16": "0b0e524ce9fa320945052441022b26595e7a58188b3162905bf23896dbbd9734",
      "tier1_q15_math": "4a31d147057151bcd018aa421cb849d57b2fc93e752b4d165763287c07e1091f",
      "tier1_ring_buffer": "750efc2fcd6fc186e414a6e470ac1e75fded4432d4e0d2133637b48ac5fa5fb4",
      "tier2_can_frame": "6c968b097ac50661e4b2dc6cbba078d03dc650f2783e3f60f47dca1d3710b4a7",
      "tier2_cobs_codec": "e0d8e38ac017a140dafb44659d93e15cc56486d29f04788d4c17d17f0f99ceeb",
      "tier2_debounce_fsm": "56a6cf42788072f4a5d8f763fe9b8af0a949105b467429f39393b78d5c15ede3",
      "tier2_fixed_control": "8a029c491576548951695257aa9fa4fa356a6e69576d14b15b126165361796d1",
      "tier2_tick_timer": "e6272cbbc9fb32e4c61a2a3f9edeaea25f1df538eabfedf955d27f246ec49b07",
      "tier2_windowed_watchdog": "3e20d96971143d41a8af56a84c797bfc174ecdc79ed862505e5c4ea020ff1f29",
      "tier3_flash_update": "4ba56b9a822341e92cea28634ff7e8d9149a178f1464067df62096c0024d4afc",
      "tier3_i2c_sensor": "e62411cdda2ec00ca0fd6ba391d68383136b2612c09c3fad3fa53c54b3fa4e29",
      "tier3_spi_flash": "96a4304c7f4c86329488c46c5d68959f2c32e34b5a6da232b9fb0b5ce61f8517",
      "tier4_bitmask_fix": "fc8c25e65a54af7ec6392f9b3aeec4c05c0299bef406cfce00d72e3a5869b4bd",
      "tier4_dma_buffer": "5040d14fc7bf57da2fdd7b1aff52417df7ec8ae7c776234b00af7a8cc3e878dd",
      "tier4_uart_frame_fix": "ea4941ba7dc4d03dd0b23220137c76fb4ceec7f47bad93c60813be8f2de55462"
    },
    "dataset_sha256": "96b16b5b2685cdb873c04e4f83b0123cf5af92226bd236aa44f20a1adcdede50",
    "unreadable_assets": {},
    "generation_settings": null,
    "scoring_policy": {
      "formula_version": "functional-gated-v1",
      "safety_error_penalty": 15,
      "safety_warning_penalty": 3,
      "tasks": {
        "tier1_crc16": {
          "weights": {
            "functional": 0.6,
            "memory": 0.2,
            "safety": 0.2
          },
          "limits": {
            "max_flash_bytes": 1024,
            "max_ram_bytes": 128,
            "timeout_seconds": 5
          }
        },
        "tier1_q15_math": {
          "weights": {
            "functional": 0.6,
            "memory": 0.2,
            "safety": 0.2
          },
          "limits": {
            "max_flash_bytes": 1024,
            "max_ram_bytes": 0,
            "timeout_seconds": 5
          }
        },
        "tier1_ring_buffer": {
          "weights": {
            "functional": 0.6,
            "memory": 0.2,
            "safety": 0.2
          },
          "limits": {
            "max_flash_bytes": 2048,
            "max_ram_bytes": 128,
            "timeout_seconds": 5
          }
        },
        "tier2_can_frame": {
          "weights": {
            "functional": 0.6,
            "memory": 0.2,
            "safety": 0.2
          },
          "limits": {
            "max_flash_bytes": 8192,
            "max_ram_bytes": 256,
            "timeout_seconds": 5
          }
        },
        "tier2_cobs_codec": {
          "weights": {
            "functional": 0.6,
            "memory": 0.2,
            "safety": 0.2
          },
          "limits": {
            "max_flash_bytes": 2048,
            "max_ram_bytes": 0,
            "timeout_seconds": 5
          }
        },
        "tier2_debounce_fsm": {
          "weights": {
            "functional": 0.6,
            "memory": 0.2,
            "safety": 0.2
          },
          "limits": {
            "max_flash_bytes": 1536,
            "max_ram_bytes": 128,
            "timeout_seconds": 5
          }
        },
        "tier2_fixed_control": {
          "weights": {
            "functional": 0.6,
            "memory": 0.2,
            "safety": 0.2
          },
          "limits": {
            "max_flash_bytes": 2048,
            "max_ram_bytes": 128,
            "timeout_seconds": 5
          }
        },
        "tier2_tick_timer": {
          "weights": {
            "functional": 0.6,
            "memory": 0.2,
            "safety": 0.2
          },
          "limits": {
            "max_flash_bytes": 1536,
            "max_ram_bytes": 0,
            "timeout_seconds": 5
          }
        },
        "tier2_windowed_watchdog": {
          "weights": {
            "functional": 0.6,
            "memory": 0.2,
            "safety": 0.2
          },
          "limits": {
            "max_flash_bytes": 4096,
            "max_ram_bytes": 256,
            "timeout_seconds": 5
          }
        },
        "tier3_flash_update": {
          "weights": {
            "functional": 0.6,
            "memory": 0.2,
            "safety": 0.2
          },
          "limits": {
            "max_flash_bytes": 3072,
            "max_ram_bytes": 128,
            "timeout_seconds": 5
          }
        },
        "tier3_i2c_sensor": {
          "weights": {
            "functional": 0.6,
            "memory": 0.2,
            "safety": 0.2
          },
          "limits": {
            "max_flash_bytes": 2048,
            "max_ram_bytes": 256,
            "timeout_seconds": 5
          }
        },
        "tier3_spi_flash": {
          "weights": {
            "functional": 0.6,
            "memory": 0.2,
            "safety": 0.2
          },
          "limits": {
            "max_flash_bytes": 3072,
            "max_ram_bytes": 128,
            "timeout_seconds": 5
          }
        },
        "tier4_bitmask_fix": {
          "weights": {
            "functional": 0.6,
            "memory": 0.2,
            "safety": 0.2
          },
          "limits": {
            "max_flash_bytes": 1024,
            "max_ram_bytes": 128,
            "timeout_seconds": 5
          }
        },
        "tier4_dma_buffer": {
          "weights": {
            "functional": 0.6,
            "memory": 0.2,
            "safety": 0.2
          },
          "limits": {
            "max_flash_bytes": 2048,
            "max_ram_bytes": 128,
            "timeout_seconds": 5
          }
        },
        "tier4_uart_frame_fix": {
          "weights": {
            "functional": 0.6,
            "memory": 0.2,
            "safety": 0.2
          },
          "limits": {
            "max_flash_bytes": 2048,
            "max_ram_bytes": 128,
            "timeout_seconds": 5
          }
        }
      }
    },
    "execution_settings": {
      "compile_timeout_seconds": 30.0,
      "max_output_bytes": 1048576,
      "isolation": "native",
      "memory_limit_bytes": null,
      "sanitizers": [],
      "compiler_warnings": false,
      "warning_flags": [],
      "stack_usage": false,
      "containment": null,
      "candidate_environment": "minimal-v1",
      "oracle_policy": "private-unity-state-v1",
      "hardening": {
        "policy": "auto",
        "compile_flags": [],
        "binary_flags": [],
        "available": false
      },
      "resource_limits": {
        "process_count": 64,
        "process_count_scope": "job",
        "file_size_bytes": null,
        "core_bytes": null,
        "open_files": null
      },
      "process_backend": "windows-job",
      "cpu_limit": null,